{"$id":"urn:otqa:v1:audit","$schema":"https://json-schema.org/draft/2020-12/schema","additionalProperties":false,"properties":{"audit_id":{"format":"uuid","type":"string"},"auditor":{"$ref":"urn:otqa:v1:common#/$defs/Source"},"checks":{"items":{"additionalProperties":false,"properties":{"artifact":{"anyOf":[{"$ref":"urn:otqa:v1:common#/$defs/FileRef"},{"type":"null"}]},"check_id":{"pattern":"^[A-Za-z0-9][A-Za-z0-9._-]{0,127}$","type":"string"},"json_pointer":{"anyOf":[{"type":"string"},{"type":"null"}]},"message":{"minLength":1,"type":"string"},"status":{"enum":["passed","failed","not_applicable"]}},"required":["check_id","status","message","artifact","json_pointer"],"type":"object"},"minItems":1,"type":"array"},"created_at_utc":{"format":"date-time","pattern":"Z$","type":"string"},"plan":{"$ref":"urn:otqa:v1:common#/$defs/FileRef"},"prefix_snapshots":{"items":{"$ref":"urn:otqa:v1:common#/$defs/FileRef"},"minItems":0,"type":"array"},"schema_version":{"const":1},"series_id":{"format":"uuid","type":"string"},"state":{"$ref":"urn:otqa:v1:common#/$defs/FileRef"},"status":{"enum":["passed","failed","partial"]}},"required":["schema_version","audit_id","series_id","created_at_utc","auditor","plan","state","prefix_snapshots","status","checks"],"type":"object"}
