{"audit_id":"d7fa5624-30e9-5c73-9c97-86f51b2837f3","auditor":{"dirty":false,"git_commit":"62d1d01339f91802e2916b63660a4e640d99c9cc","inventory_format":"otqa-source-v1","source_sha256":"720726607ae451b319e59e01453b6ba69b9950ef42420e700ed6b4eaa5b34d0e","version":"0.2.0"},"checks":[{"artifact":null,"check_id":"plan-state-and-frozen-inputs","json_pointer":null,"message":"Verified","status":"passed"},{"artifact":null,"check_id":"materialization","json_pointer":null,"message":"Verified","status":"passed"},{"artifact":{"path":"jobs/job000001/attempts/attempt0001/result.json","sha256":"9bf667865eaf2725bbd5ccb1a3fc1ea7aad3ede20157a57b9e987ad5bf69bed4"},"check_id":"job000001-attempt0001","json_pointer":null,"message":"Verified","status":"passed"},{"artifact":{"path":"jobs/job000002/attempts/attempt0001/result.json","sha256":"1fb8eb71b21aaf0dc295cabf5c945910cc03c26f190530b066c2286d830b77f7"},"check_id":"job000002-attempt0001","json_pointer":null,"message":"Verified","status":"passed"},{"artifact":{"path":"jobs/job000003/attempts/attempt0001/result.json","sha256":"5b891b6b5faf2e70119e51b7a34f9227c1dc43e62fc36bf5d265d9a8446cc8e7"},"check_id":"job000003-attempt0001","json_pointer":null,"message":"Verified","status":"passed"},{"artifact":{"path":"jobs/job000004/attempts/attempt0001/result.json","sha256":"00ffd2b331dab0c720cf9996aa658cad7b5fad6b017076252c8046db8e490554"},"check_id":"job000004-attempt0001","json_pointer":null,"message":"Verified","status":"passed"},{"artifact":{"path":"jobs/job000005/attempts/attempt0001/result.json","sha256":"08afba75eb81e09b612239b83720347b43db16173f6abe0d066e38d866efcdea"},"check_id":"job000005-attempt0001","json_pointer":null,"message":"Verified","status":"passed"},{"artifact":{"path":"jobs/job000006/attempts/attempt0001/result.json","sha256":"3ca2ee8221ec7b126df49219c5a29a90c7f01d33c80d36cc9e46a387ab1ffcd0"},"check_id":"job000006-attempt0001","json_pointer":null,"message":"Verified","status":"passed"},{"artifact":{"path":"jobs/job000007/attempts/attempt0001/result.json","sha256":"50053513c4bb1ad3a321d49edc8867cb6e74a88586839ee6be9b45d030740260"},"check_id":"job000007-attempt0001","json_pointer":null,"message":"Verified","status":"passed"},{"artifact":{"path":"jobs/job000008/attempts/attempt0001/result.json","sha256":"3890d4453117e929d7856cba2e7672e281cf603359b46aa235e53a94cab4b8c0"},"check_id":"job000008-attempt0001","json_pointer":null,"message":"Verified","status":"passed"},{"artifact":{"path":"jobs/job000009/attempts/attempt0001/result.json","sha256":"4c33812a31634a250fde569f40850664b76b963f3f3044e251def06f365efd6c"},"check_id":"job000009-attempt0001","json_pointer":null,"message":"Verified","status":"passed"},{"artifact":{"path":"jobs/job000010/attempts/attempt0001/result.json","sha256":"8435d80cf832f437fa41233c0733aafb68e537e004c12117ca674ba35780d660"},"check_id":"job000010-attempt0001","json_pointer":null,"message":"Verified","status":"passed"}],"created_at_utc":"2026-10-17T23:46:54.568290Z","plan":{"path":"plan.json","sha256":"84ca97dc689ab2710502c80bd71fa566207bb8bc113c7508b320f17a51f6012a"},"prefix_snapshots":[],"schema_version":1,"series_id":"a42142d0-d144-40ea-b2fc-bfa3c089911e","state":{"path":"reports/d7fa5624-30e9-5c73-9c97-86f51b2837f3/state-snapshot.json","sha256":"b32a2ed8d76e2641312778c2b0cd550fad0ffecb39a9430f2a37599f24090ee2"},"status":"passed"}
