{"audit_id":"a0d2b946-bdef-5410-99c5-94571df0142f","auditor":{"dirty":false,"git_commit":"62d1d01339f91802e2916b63660a4e640d99c9cc","inventory_format":"otqa-source-v1","source_sha256":"720726607ae451b319e59e01453b6ba69b9950ef42420e700ed6b4eaa5b34d0e","version":"0.2.0"},"checks":[{"artifact":null,"check_id":"plan-state-and-frozen-inputs","json_pointer":null,"message":"Verified","status":"passed"},{"artifact":null,"check_id":"materialization","json_pointer":null,"message":"Verified","status":"passed"},{"artifact":{"path":"jobs/job000001/attempts/attempt0001/result.json","sha256":"2c5b3d1e0adf4d50d75495552d9dee981619640576d403ea8bb7bb5575e39ae3"},"check_id":"job000001-attempt0001","json_pointer":null,"message":"Verified","status":"passed"},{"artifact":{"path":"jobs/job000002/attempts/attempt0001/result.json","sha256":"c465a1dafa74c8fcacaaa388042d3566362a9c2b52391348ec4aa804a6df0251"},"check_id":"job000002-attempt0001","json_pointer":null,"message":"Verified","status":"passed"},{"artifact":{"path":"jobs/job000003/attempts/attempt0001/result.json","sha256":"2da26cb121e06e75c166f33ee03f862b83cfba563180f83b9f2f7a92f4ca6290"},"check_id":"job000003-attempt0001","json_pointer":null,"message":"Verified","status":"passed"},{"artifact":{"path":"jobs/job000004/attempts/attempt0001/result.json","sha256":"2dc7745deb6841c6e1047796a1e4a6e76f973ef6d84dcc663717a284c6523302"},"check_id":"job000004-attempt0001","json_pointer":null,"message":"Verified","status":"passed"},{"artifact":{"path":"jobs/job000005/attempts/attempt0001/result.json","sha256":"1327aaa23683e8709068c3fbe9bc72a9b89c52a281dfd0405b9e76e68a161050"},"check_id":"job000005-attempt0001","json_pointer":null,"message":"Verified","status":"passed"},{"artifact":{"path":"jobs/job000006/attempts/attempt0001/result.json","sha256":"7a5c94bb089a0e5def7dcb402e839f8fe0cc14e2500d677571a2ed2131f7e1c4"},"check_id":"job000006-attempt0001","json_pointer":null,"message":"Verified","status":"passed"},{"artifact":{"path":"jobs/job000007/attempts/attempt0001/result.json","sha256":"e7fdafcdfabb9d7e380c9eadfb66d97c61e88c07d9d6daed58da87f1cdd4ff01"},"check_id":"job000007-attempt0001","json_pointer":null,"message":"Verified","status":"passed"},{"artifact":{"path":"jobs/job000008/attempts/attempt0001/result.json","sha256":"b95718d5ddab971ed11e83d9f2d46b748b6ddb2ce54b3eb204cd2d2a1148f0a0"},"check_id":"job000008-attempt0001","json_pointer":null,"message":"Verified","status":"passed"},{"artifact":{"path":"jobs/job000009/attempts/attempt0001/result.json","sha256":"b3f0338f0b26177b79d299af986de8efe2a3fcfa3c76efc8a99b8becb33fa86b"},"check_id":"job000009-attempt0001","json_pointer":null,"message":"Verified","status":"passed"},{"artifact":{"path":"jobs/job000010/attempts/attempt0001/result.json","sha256":"94e80b9b90e37b97ef23bf8cf132d3fed61dfa9e3a23f0493f6a5132308fd50c"},"check_id":"job000010-attempt0001","json_pointer":null,"message":"Verified","status":"passed"}],"created_at_utc":"2026-10-17T23:32:48.585838Z","plan":{"path":"plan.json","sha256":"50a6708969a7b62748ce8354d36f92b7ef29e75f61bd80a29b221223e46e9c37"},"prefix_snapshots":[],"schema_version":1,"series_id":"3b9ca582-a775-4351-bb30-206fd2dbddfd","state":{"path":"reports/a0d2b946-bdef-5410-99c5-94571df0142f/state-snapshot.json","sha256":"18ae9cdc943d7eb036bb5c4445af2adeba6266732a239168a3514993f94603f7"},"status":"passed"}
