{"audit_id":"f5665c5d-f43a-58a0-8610-25f36bd0e91c","auditor":{"dirty":false,"git_commit":"62d1d01339f91802e2916b63660a4e640d99c9cc","inventory_format":"otqa-source-v1","source_sha256":"720726607ae451b319e59e01453b6ba69b9950ef42420e700ed6b4eaa5b34d0e","version":"0.2.0"},"checks":[{"artifact":null,"check_id":"plan-state-and-frozen-inputs","json_pointer":null,"message":"Verified","status":"passed"},{"artifact":null,"check_id":"materialization","json_pointer":null,"message":"Verified","status":"passed"},{"artifact":{"path":"jobs/job000001/attempts/attempt0001/result.json","sha256":"69cc6b11ef7336376966f44af68091bf30471fb6d3cceff94038d933c1ffdd01"},"check_id":"job000001-attempt0001","json_pointer":null,"message":"Verified","status":"passed"},{"artifact":{"path":"jobs/job000002/attempts/attempt0001/result.json","sha256":"ac559c6eca76b6f9a01b78f222d3958654bd8237e6626269f325a4ed9aa2da6e"},"check_id":"job000002-attempt0001","json_pointer":null,"message":"Verified","status":"passed"},{"artifact":{"path":"jobs/job000003/attempts/attempt0001/result.json","sha256":"9578ea812c56ef48eb58a2379319e179bf752c90ad191eb1f746689c74dbea12"},"check_id":"job000003-attempt0001","json_pointer":null,"message":"Verified","status":"passed"},{"artifact":{"path":"jobs/job000004/attempts/attempt0001/result.json","sha256":"b794259d3433fc82c3ef19b02e6896de2b5f586a80e1997a12505c3ab2ae8dd0"},"check_id":"job000004-attempt0001","json_pointer":null,"message":"Verified","status":"passed"},{"artifact":{"path":"jobs/job000005/attempts/attempt0001/result.json","sha256":"f4e99b53ff65814943713ff0e40e47b8c761dad690ba9734fd7c1fa081f2bfc7"},"check_id":"job000005-attempt0001","json_pointer":null,"message":"Verified","status":"passed"},{"artifact":{"path":"jobs/job000006/attempts/attempt0001/result.json","sha256":"fa9ab37476d988c4ea72eefb605c6d41af8f870bb44aee9d623da9fc18a732aa"},"check_id":"job000006-attempt0001","json_pointer":null,"message":"Verified","status":"passed"},{"artifact":{"path":"jobs/job000007/attempts/attempt0001/result.json","sha256":"b7cbde47e4c393eda5773ea68aca53af0bcfa7225acb6035e0b9f17f7e17d36b"},"check_id":"job000007-attempt0001","json_pointer":null,"message":"Verified","status":"passed"},{"artifact":{"path":"jobs/job000008/attempts/attempt0001/result.json","sha256":"4de7e309bc53c8e0f1ffefb61bbbfeff2a0ca46312370ddc4e72bea313c56e5a"},"check_id":"job000008-attempt0001","json_pointer":null,"message":"Verified","status":"passed"},{"artifact":{"path":"jobs/job000009/attempts/attempt0001/result.json","sha256":"c99238bb199cd618313d1d4b844e446c9b7a42a3246cd5d9a58c18338e1eb75d"},"check_id":"job000009-attempt0001","json_pointer":null,"message":"Verified","status":"passed"},{"artifact":{"path":"jobs/job000010/attempts/attempt0001/result.json","sha256":"067fb6ced101335e60b013228b78d986657e9ba0cca5044a61aa91c860a5a3c4"},"check_id":"job000010-attempt0001","json_pointer":null,"message":"Verified","status":"passed"}],"created_at_utc":"2026-10-17T23:08:58.025539Z","plan":{"path":"plan.json","sha256":"90a31eb5a12c96ab02597c6c0b8d141aef7b40c91b0c4461c31ddb9834709028"},"prefix_snapshots":[],"schema_version":1,"series_id":"f8555c29-fc57-4d44-bd01-137648a0f07e","state":{"path":"reports/f5665c5d-f43a-58a0-8610-25f36bd0e91c/state-snapshot.json","sha256":"122fc3fac981a57dbcfd09e0ad84955edc9ea1692913d6994f36cf9baf5233bb"},"status":"passed"}
